id,emoji,titleKo,titleEn,category,difficulty
1,👁️,비둘기와 10초 동안 눈 마주치기,Make eye contact with the pigeon for 10 seconds,관찰 / observation,easy
2,🚗,지나가는 차 번호 하루종일 외우기,Count the 5 colors of passing cars,관찰 / observation,easy
3,☁️,구름에서 동물 모양 찾기,Find animal shapes in the clouds,관찰 / observation,easy
4,⭕,주변에서 동그란 것 5개 찾기,Find 5 round things around you,관찰 / observation,easy
5,🛗,엘리베이터 층버튼 중 가장 많이 눌린 거 추측하기,Guess which elevator button was pressed the most?,관찰 / observation,easy
6,🚦,신호등이 바뀌는 순간을 카운트 해서 맞추기,Count and adjust the moment when the traffic light changes,관찰 / observation,easy
7,🧦,오늘 신은 양말 어디서났는지 생각하기,Describe exactly the pattern of the socks you wore today,관찰 / observation,easy
8,🌳,주변의 나무 이름 하나 찾아보기,Remember the tallest tree you passed today,관찰 / observation,easy
9,🐜,개미 발견하고 30초간 따라다니기,Spot an ant and follow it for 30 seconds.,관찰 / observation,easy
10,🔲,주변에서 가장 완벽한 네모 찾기,Find the most perfect square around,관찰 / observation,easy
11,🐕,오늘 본 강아지 이름 마음대로 짓기,Guess the breed of dog you saw today,관찰 / observation,medium
12,🎨,자화상 그려서 친구에게 팔기,Name the three main colors of the scenery you see now.,관찰 / observation,easy
13,👣,주변 사물에서 눈코입 모양 찾기,"Find the shape of eyes, nose, and mouth in objects around you",관찰 / observation,easy
14,😑,1분동안 눈감고 들리는 소리에 집중하기,List 10 things you see outside your window,관찰 / observation,easy
15,⏱️,눈 감고 정확히 1분 세어보기,Close your eyes and count to exactly one minute,관찰 / observation,medium
16,🗑️,길에서 쓰레기통 3개 찾기,Find 3 trash cans on the street,관찰 / observation,easy
17,🌈,주변에서 무지개 색 순서대로 빨리 찾기,Find rainbow colors around you in order,관찰 / observation,hard
18,🚶,앞 사람 걸음에 발맞춰 걷기,Count 10 steps of the person in front of you,관찰 / observation,easy
19,📦,편의점에서 가장 이상한 상품 이름 찾기,Find the strangest product names at convenience stores,관찰 / observation,easy
20,🔍,주변에서 글자 'ㅎ'이 들어간 간판 찾기,Find a sign with the letter ‘ㅎ’ nearby.,관찰 / observation,easy
21,🏪,편의점에서 가장 싼물건 사기,Count steps to the nearest convenience store,관찰 / observation,medium
22,💡,발명 하나 하기,Count the number of lights currently visible,관찰 / observation,easy
23,🎩,"누군가에게 '보스, 부르셨습니까?' 하고 말하기","Ask someone, 'boss, did you call me?'and say",말하기 / speech,medium
24,📻,오늘 들은 노래를 라디오 DJ처럼 소개하기,Introduce the song you heard today like a radio dj,말하기 / speech,easy
25,🫡,군인처럼 말하기,"When i was called for the first time today, i said 'yes!'and answer loudly",말하기 / speech,easy
26,🌟,"자기 이름 붙여서 말하기(예:""민기는 지금 배고파."")",Say ‘good job’ out loud to yourself,말하기 / speech,easy
27,🧙,내일에 대한 예언 하나 하기,Say sentences beginning with 'i prophesy...',말하기 / speech,medium
28,🤖,로봇 말투로 5분 대화하기,Have a 5-minute conversation in a robot tone,말하기 / speech,hard
29,🎤,혼자 집에서 시상식 수상소감 말하기,Giving acceptance speech at the awards ceremony alone at home,말하기 / speech,easy
30,🦸,좋아하는 영화 대사 상대에게 말하기,Tell your partner your favorite movie line,말하기 / speech,medium
31,📖,오늘 먹은 메뉴를 맛 해설가처럼 설명하기,Explaining today’s menu like a taste expert,말하기 / speech,easy
32,🗣️,거울 보고 '넌 할 수 있어' 3번 말하기,Look in the mirror and say ‘you can do it’ 3 times,말하기 / speech,easy
33,🐶,동물 울음소리 3가지 진지하게 연습하기,Make 3 animal sounds in a row,말하기 / speech,easy
34,👋,모르는 사람에게 손 흔들어보기,Wave to a stranger,말하기 / speech,medium
35,💬,대화 중 갑자기 속담 하나 끼워넣기,Suddenly inserting a proverb into a conversation,말하기 / speech,medium
36,🗞️,아침에 '속보입니다!' 하고 가족에게 아무 말 전하기,"In the morning, 'breaking news!'and don't say anything to your family.",말하기 / speech,easy
37,🧐,그런데 말입니다...'하고 아무 의견 말하기,Saying anything with 'i think...',말하기 / speech,easy
38,🍚,몇 번의 숟가락질로 밥 다먹는지 세보기,Eating while counting numbers,음식 / food,easy
39,🦶,두 번째 발가락만 움직여보기,Be thankful for 3 seconds every time you eat a bowl of rice,음식 / food,easy
40,🥢,숟가락 없이 젓가락만으로 밥 다 먹기,"Eat the whole meal with just chopsticks, without a spoon",음식 / food,medium
41,🍽️,접시 위 음식 색깔 개수 세기,Count the colors of food on your plate,음식 / food,easy
42,🐢,한 입 먹고 30초 쉬고 반복하기,"Take a bite, rest for 30 seconds and repeat.",음식 / food,medium
43,🎵,음식 씹는 소리에 집중해보기,Focus on the sound of chewing food,음식 / food,easy
44,🧊,얼음 하나 입에 넣고 녹을 때까지 기다리기,Put an ice cube in your mouth and wait for it to melt.,음식 / food,easy
45,🤏,한 입을 최대한 작게 먹어보기,Take one bite as small as possible,음식 / food,easy
46,🍕,피자를 바깥 쪽부터 먹기,Eat pizza from the inside out,음식 / food,easy
47,🥄,국물 요리를 포크로 먹기,Try eating soup with a fork,음식 / food,hard
48,🍜,면 한 가닥씩 먹기,Eat a piece of noodles at a time,음식 / food,hard
49,🥕,오늘 간식 먹을 때 채소 한 개 같이 먹기,Eat a vegetable with your snack today,음식 / food,easy
50,🛗,엘리베이터에서 벽보고 서서 혼자 음흉하게 웃기,Turning around in the elevator,움직임 / movement,medium
51,🪜,계단 마지막 칸을 두 칸 한꺼번에 올라가기,Climb the last step of the stairs two at once,움직임 / movement,easy
52,🚪,오늘 모든 문을 오른발로 먼저 들어가기,"Today, enter every door with your right foot first.",움직임 / movement,easy
53,🧍,신호 기다릴 때 발꿈치 들었다 내리기 10번,Raise and lower your heels 10 times when waiting for a signal,움직임 / movement,easy
54,🤲,뒷짐 지고 5분 걷기,Turn your back and walk for 5 minutes,움직임 / movement,easy
55,🧗,계단을 한 칸씩 아주 느리게 올라가기,Climbing the stairs one step at a time very slowly,움직임 / movement,easy
56,💃,아무도 없을 때 3초 춤추기,Dance for 3 seconds when no one is around,움직임 / movement,easy
57,🏃,횡단보도에서 흰색 줄무늬만 밟기,Only step on the white stripes at crosswalks,움직임 / movement,easy
58,🧘,의자에서 눈 감고 30초 명상하기,Close your eyes and meditate for 30 seconds in a chair,움직임 / movement,easy
59,🚶‍♂️,가운데 손가락만 편 주먹을 주머니에 넣고 다니기,Carry around with your hand only in your left pocket today.,움직임 / movement,easy
60,👞,신발 끈을 평소와 다른 방식으로 묶기,Tying your shoelaces in a different way than usual,움직임 / movement,easy
61,🤔,얼굴에 점 세보기,Turn around when sitting on a chair,움직임 / movement,easy
62,🎬,액션 영화 대사 하나 외우기,Memorize a line from an action movie,창의 / creative,easy
63,📜,내 이름으로 삼행시 짓기,Write a three-line poem in my name,창의 / creative,easy
64,👗,친구와 드레스코드 맞춰서 만나기,Assign a fashion concept name to the clothes you wore today,창의 / creative,easy
65,📖,보이는 물건 3개로 즉석 이야기 만들기,Create an impromptu story with 3 visible objects,창의 / creative,medium
66,🎵,지금 들리는 소리로 노래 가사 만들기,Create song lyrics using the sounds you hear now,창의 / creative,medium
67,🎨,종이에 30초 안에 강아지 그리기,How to draw a dog on paper in 30 seconds,창의 / creative,easy
68,🤳,지금 가장 재미있는 표정 짓고 셀카 찍기,Take a selfie with the funniest facial expression right now.,창의 / creative,easy
69,✍️,왼손(또는 반대 손)으로 내 이름 써보기,Write your name with your left hand (or the other hand),창의 / creative,easy
70,🎪,오늘 본 사람 중 한 명에게 별명 지어주기,Give a nickname to one of the people you saw today,창의 / creative,easy
71,🗺️,집에서 학교/회사까지 길을 그림으로 그리기,Draw a picture of the route from home to school/work,창의 / creative,medium
72,📱,하루 동안 핸드폰 배경화면에 부끄러운 사진 걸어놓기,Write a poem explaining your phone wallpaper,창의 / creative,medium
73,🪱,지렁이 구해주기,Give our house a name,창의 / creative,easy
74,🔮,내일 있을 일 3가지 예측해보기,Predict 3 things that will happen tomorrow,창의 / creative,easy
75,💇,머리카락 하나 뽑아서 거슬리게 두기,Pull out a hair and let it bother you,혼자 / solo,easy
76,📱,핸드폰을 5분 동안 아무것도 안 하고 바라보기,Stare at your phone without doing anything for 5 minutes,혼자 / solo,easy
77,👀,눈 깜빡이지 않고 최대한 오래 버티기,Hold on for as long as possible without blinking.,혼자 / solo,easy
78,🧠,초등학교 때 친구 이름 5명 떠올리기,Recall the names of 5 friends from elementary school,혼자 / solo,easy
79,👅,혀로 코 닿기 시도해보기,Try touching your nose with your tongue,혼자 / solo,easy
80,🦷,혀로 이빨 개수 세어보기,Count your teeth with your tongue,혼자 / solo,easy
81,🤲,양손으로 동시에 다른 글자 써보기,Try writing different letters with both hands at the same time,혼자 / solo,hard
82,🖐️,다른 사람이랑 손가락 길이 재보기,Measure your finger length with someone else,사회적 / social,medium
83,💅,손톱에 눈코입 그리기,"Drawing eyes, nose and mouth on nails",혼자 / solo,easy
84,😊,오늘 처음 만난 사람에게 별명 지어주기,Give a nickname to someone you meet for the first time today,사회적 / social,medium
85,👏,누군가의 옷을 칭찬하기,Compliment someone's clothes,사회적 / social,easy
86,☕,카페에서 '오늘 제 인생 최고의 날이에요' 하고 말하기,Saying ‘today is the best day of my life’ at a cafe,사회적 / social,hard
87,❤️,가족에게 갑자기 이유 없이 '사랑해요' 문자 보내기,Suddenly texting your family ‘i love you’ for no reason,사회적 / social,easy
88,🎂,가장 먼저 만난 사람에게 생일 물어보기,Ask the first person you meet about their birthday,사회적 / social,easy
89,🍀,누군가에게 '오늘 뭔가 좋은 일 생길 것 같아요' 말하기,Saying to someone ‘i think something good will happen today’,사회적 / social,easy
90,🙋,엘리베이터에서 모르는 사람에게 인사하기,Greeting strangers in the elevator,사회적 / social,medium
91,🎁,"친구에게 사소한 선물 하나 주기 (사탕, 메모지 등)","Give a small gift to a friend (candy, note paper, etc.)",사회적 / social,easy
92,💌,가족에게 '오늘 다들 고생 많으셨어요' 보내기,Send ‘thank you all for your hard work today’ to your family,사회적 / social,easy
93,👖,잘 안입는 옷 주머니에 5천원 넣어놓기,Shake hands with someone you met today,사회적 / social,medium
94,📞,오래 연락 안 한 친구에게 먼저 연락하기,Contact a friend you haven't seen in a while first,사회적 / social,easy
95,🗨️,편의점 직원에게 칭찬하기,Complimenting convenience store employees,사회적 / social,easy
96,👍,SNS에서 아무 게시물이나 좋아요 10개 누르기,Click 10 likes on any post on social media,사회적 / social,easy
97,🤷,친구에게 '혹시 나에 대해 궁금한 거 없어?' 물어보기,"Ask your friend, 'do you have any questions about me?'ask",사회적 / social,medium
98,🫶,부모님에게 '어렸을 때 제가 제일 귀여웠을 때가 언제예요?' 물어보기,"Ask your parents, 'when was i the cutest when i was little?'ask",사회적 / social,easy
99,🏠,이웃에게 외국어로 인사하기,Greeting neighbors in a foreign language,사회적 / social,easy
100,👫,친구와 10초 동안 눈 마주치기 대결하기,Make eye contact with a friend for 10 seconds,사회적 / social,easy
101,🙈,누군가에게 '비밀인데...' 하고 아무 말이나 하기,Saying anything to someone like ‘it’s a secret…’,사회적 / social,easy
102,🏷️,옷 태그에 적힌 세탁 방법 소리내어 읽어보기,Read washing instructions on clothing tags,혼자 / solo,easy
103,🧤,주머니 속 물건 만져서 뭔지 맞추기,Guess what's in your pocket by touching it,혼자 / solo,easy
104,🪥,이 닦을 때 반대 손으로 닦기,"When brushing your teeth, use the opposite hand",혼자 / solo,easy
105,⌚,시계 안 보고 지금 몇 시인지 맞추기,Find out what time it is without looking at the clock,혼자 / solo,easy
106,📚,아무 책이나 펴서 첫 문장 읽기,Open any book and read the first sentence,창의 / creative,easy
107,🗓️,오늘 날짜를 다른 달력(음력 등)으로 뭔지 찾아보기,"Find today's date in another calendar (lunar calendar, etc.)",창의 / creative,easy
108,🎯,종이 구겨서 쓰레기통에 던지기 (3점슛),Crumple up the paper and throw it in the trash can (3-point shot),움직임 / movement,easy
109,✂️,종이를 손으로만 완벽한 원 모양으로 찢기,Tear paper into a perfect circle using only your hands.,창의 / creative,hard
110,🤹,물건 2개로 저글링 도전하기,Challenge yourself to juggle two objects,움직임 / movement,medium
111,🗂️,핸드폰 사진첩에서 1년 전 사진 찾아보기,Find photos from a year ago in your phone photo album,혼자 / solo,easy
112,🦾,팔씨름 자세 잡고 혼자 힘주기,Arm wrestling stance and strength alone,혼자 / solo,easy
113,🎺,손으로 트럼펫 소리 내기,Making trumpet sounds with your hands,창의 / creative,easy
114,🧦,양말 짝짝이로 신기,Wear matching socks,혼자 / solo,easy
115,☂️,비 안와도 우산 가지고 나가기,Take an umbrella with you even if it’s not raining,혼자 / solo,easy
116,🐢,슬로우 모션으로 움직여보기,Move in slow motion,움직임 / movement,easy
117,📝,사인 연습하기,Practice signing,창의 / creative,easy
118,🎬,영화 엔딩 크레딧 끝까지 보기,Watch until the end credits of the movie,창의 / creative,easy
119,🎊,아무 종이나 최대한 작게 쪼개기,Break any piece of paper into as small pieces as possible.,혼자 / solo,easy
120,❗️,새로운 감탄사 하나 만들기,Create a new exclamation,말하기 / speech,easy
121,🤌,이탈리아 사람처럼 손 제스처 하며 말하기,Speak with hand gestures like an italian,말하기 / speech,easy
122,✨,오늘 가장 반짝이는 것 찾기,Find the brightest thing today,관찰 / observation,easy